id,nome,imagem_url,status,tipo_problema,endereço,latitude,longitude,descricao,cpf
1,Teto caindo na escola,https://thumbs.dreamstime.com/b/sala-de-aula-dentro-da-velha-escola-oneroom-fair-play-co-julho-uma-no-museu-cidade-do-parque-sul-230930182.jpg,0,escolar,rua xxx,-15.7801,-47.9292,sim,123.456.789-09
2,Entulho na frente da minha casa,https://tse2.mm.bing.net/th/id/OIP.BixT8Na8q70BFQK5Um2UCwHaE7?rs=1&pid=ImgDetMain&o=7&rm=3,0,escolar,rua xxx,-23.5505,-46.6333,sim,123.456.789-09
3,Barracos construidos na ponte,https://oimparcial.com.br/app/uploads/2016/12/261016____capa_vida____morando_em_baixo_da_ponte__foto_honorio_moreira__3_-334885-768x512.jpg,0,escolar,rua xxx,-3.1019,-60.0250,sim,123.456.789-09
4,Animais,/static/assets/problem_images/20251106_104706_133803435874020225.jpg,Em andamento,Urbano,"Avenida Vieira Souto, Ipanema, Rio de Janeiro",-22.9862352,-43.2113920,Um canguru na praia,089.326.267-665,Outros,/static/assets/problem_images/20251106_221320_133694368490813703.jpg,Em andamento,Urbano,"Avenida César Hilal, 1405, Santa Lúcia, Vitória, Espírito Santo, 29056-930",-20.3096064,-40.2980864,Descrição de exemplo,anonymous
5,Lixo Insalubre na Rua,/static/assets/problem_images/20251109_204707_lixo_na_rua.jpg,Em andamento,Urbano,"Rua Misael Pedreira da Silva, 280, Santa Lúcia, Vitória, Espírito Santo, 29056-083",-20.3096064,-40.3013632,"Muito lixo na rua, além de insalubre, impossível de viver nessa região, alto risco de contaminação. Necessita de limpeza o quanto antes!",123.456.789-09
